{
  "schema_version": 1,
  "generated_at": "2026-09-01T16:00:00Z",
  "display_timezone": "America/Los_Angeles",
  "favorites": ["min"],
  "games": [
    {
      "id": "sample-min-gb-20260901", "kickoff": "2026-09-02T00:20:00Z", "status": "scheduled", "week": 1, "season_phase": "Regular Season",
      "away_team": { "id": "gb", "name": "Green Bay Packers", "abbreviation": "GB", "record": "0-0", "logo_url": "https://a.espncdn.com/i/teamlogos/nfl/500/gb.png", "colors": { "primary": "#203731", "secondary": "#B9975B" } },
      "home_team": { "id": "min", "name": "Minnesota Vikings", "abbreviation": "MIN", "record": "0-0", "logo_url": "https://a.espncdn.com/i/teamlogos/nfl/500/min.png", "colors": { "primary": "#4F2683", "secondary": "#2C1646" } },
      "away_score": null, "home_score": null, "network": "Sample Network", "venue": "U.S. Bank Stadium",
      "away_jersey": "White", "home_jersey": "Purple", "injuries": [{ "team": "Minnesota Vikings", "player": "Sample Player", "status": "Questionable", "detail": "Fixture data" }],
      "notes": "Sample data for local development. Production data is generated by the synchronization workflow."
    },
    {
      "id": "sample-chi-det-20260901", "kickoff": "2026-09-02T02:00:00Z", "status": "final", "week": 1, "season_phase": "Regular Season",
      "away_team": { "id": "chi", "name": "Chicago Bears", "abbreviation": "CHI", "record": "0-1", "logo_url": "https://a.espncdn.com/i/teamlogos/nfl/500/chi.png", "colors": { "primary": "#0B162A", "secondary": "#C83803" } },
      "home_team": { "id": "det", "name": "Detroit Lions", "abbreviation": "DET", "record": "1-0", "logo_url": "https://a.espncdn.com/i/teamlogos/nfl/500/det.png", "colors": { "primary": "#0076B6", "secondary": "#123B55" } },
      "away_score": 17, "home_score": 24, "network": "Sample Network", "venue": "Ford Field", "away_jersey": "White", "home_jersey": "Blue", "injuries": []
    }
  ]
}
